company,website,city,segment,description,revenue,founder,notes
Alpha Biologics Pvt Ltd,alphabio.com,Hyderabad,Specialty Biotech,Manufactures recombinant proteins and enzymes using fermentation technology. Has in-house R&D lab and pilot production facility.,30-100,Dr. Ramesh Iyer (PhD Biotech),hiring expansion export
ChemPro Additives,chemproadditives.com,Pune,Specialty Chemicals,Produces polymer additives and stabilizers for plastics industry. Operates manufacturing plant and exports to EU markets.,100-300,Ankit Mehta (Chemical Engineer),export certification
InstruTech Systems,instrutech.in,Ahmedabad,Industrial Instrumentation,Designs and manufactures process control sensors and industrial automation systems. Has engineering design and assembly unit.,30-100,Rahul Shah (Electronics Engineer),hiring
GreenCrop BioSolutions,greencropbio.com,Coimbatore,Agri Biotech,Develops biofertilizers and biopesticides using microbial technology. Owns fermentation and production facility.,<30,Dr. Kavita Nair (PhD Microbiology),expansion new plant
MedDevice Innovations,meddeviceinnovations.in,Chennai,Medical Devices,Manufactures minimally invasive surgical instruments and diagnostic devices. ISO certified and operates production unit.,100-300,Suresh Kumar (Mechanical Engineer),certification export
BulkChem Traders,bulkchem.com,Mumbai,Commodity Chemicals,Distributes bulk chemicals sourced from manufacturers. No in-house production.,300-500,Rajiv Shah (Business),none
LabServe CRO,labserve.com,Bengaluru,Life Sciences Services,Provides contract research and testing services for pharmaceutical companies. No manufacturing capability.,30-100,Dr. Neha Verma (PhD),hiring
NextGen Polymers,nextgenpoly.com,Vadodara,Performance Chemicals,Manufactures specialty resins and coatings for industrial use. Has R&D center and multiple production lines.,300-500,Dr. Amit Patel (PhD Polymer Science),expansion export hiring